{
  "$schema": "https://json-schema.org/draft/2020-12/schema",
  "$id": "context/wbs/schemas/trace-summary.schema.json",
  "title": "Trace Summary",
  "type": "object",
  "additionalProperties": false,
  "required": [
    "trace_id",
    "run_id",
    "seq",
    "packet_id",
    "slice_id",
    "agent_role",
    "attempt_index",
    "execution_state",
    "result",
    "failure_type",
    "started_at",
    "ended_at",
    "summary",
    "artifacts_used",
    "changes",
    "tests_run",
    "requested_decision",
    "next_action",
    "decision_rationale",
    "context_notes",
    "confidence"
  ],
  "properties": {
    "trace_id": {
      "type": "string",
      "minLength": 1
    },
    "run_id": {
      "type": "string",
      "minLength": 1
    },
    "seq": {
      "type": "integer",
      "minimum": 1
    },
    "packet_id": {
      "type": "string",
      "minLength": 1
    },
    "slice_id": {
      "type": "string",
      "minLength": 1
    },
    "agent_role": {
      "type": "string",
      "minLength": 1
    },
    "attempt_index": {
      "type": "integer",
      "minimum": 1
    },
    "execution_state": {
      "type": "string",
      "enum": [
        "in_progress",
        "blocked",
        "review_required",
        "done"
      ]
    },
    "result": {
      "type": "string",
      "enum": [
        "success",
        "partial",
        "failed"
      ]
    },
    "failure_type": {
      "type": "string",
      "enum": [
        "none",
        "implementation",
        "contract",
        "missing_input",
        "harness",
        "orchestration",
        "wbs"
      ]
    },
    "started_at": {
      "type": "string",
      "minLength": 1
    },
    "ended_at": {
      "type": "string",
      "minLength": 1
    },
    "summary": {
      "type": "string",
      "minLength": 1
    },
    "artifacts_used": {
      "type": "array",
      "minItems": 1,
      "items": {
        "type": "string",
        "minLength": 1
      }
    },
    "changes": {
      "type": "array",
      "items": {
        "type": "string",
        "minLength": 1
      }
    },
    "tests_run": {
      "type": "array",
      "items": {
        "type": "object",
        "additionalProperties": false,
        "required": [
          "command",
          "result"
        ],
        "properties": {
          "command": {
            "type": "string",
            "minLength": 1
          },
          "result": {
            "type": "string",
            "enum": [
              "passed",
              "failed",
              "mixed"
            ]
          }
        }
      }
    },
    "tests_skipped": {
      "type": "array",
      "items": {
        "type": "object",
        "additionalProperties": false,
        "required": [
          "command",
          "reason_code",
          "reason_detail"
        ],
        "properties": {
          "command": {
            "type": "string",
            "minLength": 1
          },
          "reason_code": {
            "type": "string",
            "enum": [
              "missing_input",
              "out_of_scope",
              "harness_unavailable",
              "not_implemented",
              "other"
            ]
          },
          "reason_detail": {
            "type": "string",
            "minLength": 1
          }
        }
      }
    },
    "decisions_made": {
      "type": "array",
      "items": {
        "type": "string",
        "minLength": 1
      }
    },
    "new_facts": {
      "type": "array",
      "items": {
        "type": "string",
        "minLength": 1
      }
    },
    "blockers": {
      "type": "array",
      "items": {
        "type": "object",
        "additionalProperties": false,
        "required": [
          "code",
          "detail"
        ],
        "properties": {
          "code": {
            "type": "string",
            "minLength": 1
          },
          "detail": {
            "type": "string",
            "minLength": 1
          }
        }
      }
    },
    "risks": {
      "type": "array",
      "items": {
        "type": "object",
        "additionalProperties": false,
        "required": [
          "code",
          "detail"
        ],
        "properties": {
          "code": {
            "type": "string",
            "minLength": 1
          },
          "detail": {
            "type": "string",
            "minLength": 1
          }
        }
      }
    },
    "feedback": {
      "type": "array",
      "items": {
        "type": "object",
        "additionalProperties": false,
        "required": [
          "target",
          "severity",
          "note"
        ],
        "properties": {
          "target": {
            "type": "string",
            "enum": [
              "packet",
              "wbs",
              "contracts",
              "harness",
              "orchestration"
            ]
          },
          "severity": {
            "type": "string",
            "enum": [
              "must_fix",
              "should_fix",
              "nice_to_have"
            ]
          },
          "note": {
            "type": "string",
            "minLength": 1
          }
        }
      }
    },
    "requested_decision": {
      "type": "string",
      "enum": [
        "accept",
        "rework",
        "block",
        "cancel",
        "remediate",
        "close",
        "dispatch"
      ]
    },
    "next_action": {
      "type": "string",
      "minLength": 1
    },
    "decision_rationale": {
      "type": "string",
      "minLength": 1
    },
    "context_notes": {
      "type": "array",
      "minItems": 1,
      "items": {
        "type": "string",
        "minLength": 1
      }
    },
    "confidence": {
      "type": "string",
      "enum": [
        "low",
        "medium",
        "high"
      ]
    }
  }
}
