{
  "trace_id": "T-EX-2026-03-06-002",
  "run_id": "RUN-EX-2026-03-06-A",
  "seq": 5,
  "packet_id": "H-EX-2026-03-06-002",
  "slice_id": "EX-MVP-TS-INSERT",
  "agent_role": "impl",
  "attempt_index": 1,
  "execution_state": "review_required",
  "result": "success",
  "failure_type": "none",
  "started_at": "2026-03-06T10:32:00+09:00",
  "ended_at": "2026-03-06T10:58:00+09:00",
  "summary": "Markdown 생성과 note editor insert command 호출까지는 구현과 테스트가 닫혔다.",
  "artifacts_used": [
    "docs/product/mvp-spec.md:12",
    "docs/product/mvp-spec.md:61",
    "docs/product/contracts/domain.ts:38",
    "docs/product/contracts/storage.ts:40",
    "context/wbs/examples/runs/RUN-EX-2026-03-06-A/support/editor-command-surface.md:1"
  ],
  "changes": [
    "apps/web/src/features/player-note/timestamp/format-timestamp.ts",
    "apps/web/src/features/player-note/timestamp/insert-current-timestamp.ts",
    "apps/web/src/features/player-note/timestamp/insert-current-timestamp.test.ts"
  ],
  "tests_run": [
    {
      "command": "pnpm test -- timestamp-format",
      "result": "passed"
    },
    {
      "command": "pnpm test -- insert-current-timestamp",
      "result": "passed"
    }
  ],
  "tests_skipped": [
    {
      "command": "pnpm test -- timestamp-ui-integration",
      "reason_code": "out_of_scope",
      "reason_detail": "UI wiring과 analytics emission은 다음 integration handoff의 범위다."
    }
  ],
  "decisions_made": [
    "impl handoff는 Markdown 생성과 note editor insert command 호출까지만 책임진다.",
    "analytics emission은 다음 integration handoff 범위로 남긴다."
  ],
  "new_facts": [
    "보강된 packet 입력만으로 integration actor가 이어받을 수 있는 수준까지 맥락이 닫힌다."
  ],
  "blockers": [],
  "risks": [
    {
      "code": "ui_wiring_pending",
      "detail": "UI wiring과 analytics emission은 아직 검증되지 않았다."
    }
  ],
  "feedback": [
    {
      "target": "wbs",
      "severity": "should_fix",
      "note": "timestamp-insert slice에 impl handoff와 integration handoff를 분리 명시하면 재작업이 줄어든다."
    }
  ],
  "requested_decision": "accept",
  "next_action": "operator가 integration actor로 player/editor wiring과 analytics 연결 packet을 발행한다.",
  "decision_rationale": "현재 handoff 범위의 AC는 충족했고, 남은 작업은 별도 integration handoff가 더 적절하다.",
  "context_notes": [
    "이 trace의 success는 slice 전체 완료가 아니라 impl handoff 완료를 의미한다."
  ],
  "confidence": "high"
}
