{
  "trace_id": "T-EX-2026-03-06-001",
  "run_id": "RUN-EX-2026-03-06-A",
  "seq": 2,
  "packet_id": "H-EX-2026-03-06-001",
  "slice_id": "EX-MVP-TS-INSERT",
  "agent_role": "impl",
  "attempt_index": 1,
  "execution_state": "review_required",
  "result": "partial",
  "failure_type": "orchestration",
  "started_at": "2026-03-06T10:00:00+09:00",
  "ended_at": "2026-03-06T10:24:00+09:00",
  "summary": "timestamp format 구현과 단위 테스트는 완료했지만 editor insert command 계약이 없어 integration-ready 판단이 불가했다.",
  "artifacts_used": [
    "docs/product/mvp-spec.md:12",
    "docs/product/mvp-spec.md:61",
    "docs/product/contracts/domain.ts:38",
    "docs/product/contracts/storage.ts:40"
  ],
  "changes": [
    "apps/web/src/features/player-note/timestamp/format-timestamp.ts",
    "apps/web/src/features/player-note/timestamp/format-timestamp.test.ts"
  ],
  "tests_run": [
    {
      "command": "pnpm test -- timestamp-format",
      "result": "passed"
    }
  ],
  "tests_skipped": [
    {
      "command": "pnpm test -- timestamp-integration",
      "reason_code": "missing_input",
      "reason_detail": "editor insert command 계약이 packet inputs에 없어 wiring 검증을 닫지 못했다."
    }
  ],
  "decisions_made": [
    "표시 포맷을 HH:MM:SS로 고정했다.",
    "이번 handoff는 button 삽입 기준으로만 판단했다."
  ],
  "new_facts": [
    "현재 packet만으로는 note editor insert command의 입력/출력 경계를 복원할 수 없다."
  ],
  "blockers": [],
  "risks": [
    {
      "code": "editor_surface_undefined",
      "detail": "editor insert command의 입력과 부작용 경계가 불명확하다."
    }
  ],
  "feedback": [
    {
      "target": "packet",
      "severity": "must_fix",
      "note": "editor insert command 입력 문서를 packet inputs에 추가해야 한다."
    },
    {
      "target": "contracts",
      "severity": "should_fix",
      "note": "analytics 연결 여부를 이번 handoff의 범위 밖으로 명시하는 편이 좋다."
    }
  ],
  "requested_decision": "rework",
  "next_action": "operator가 editor command surface를 명시한 재작업 packet을 발행한다.",
  "decision_rationale": "입력 부족이 주요 원인이므로 구현 재시도보다 packet 보강 후 재작업이 적절하다.",
  "context_notes": [
    "이번 handoff는 markdown 생성 로직까지는 검증했지만 editor wiring은 닫지 못했다.",
    "impl actor가 본 실패 원인은 implementation이 아니라 orchestration이다."
  ],
  "confidence": "medium"
}
